{
  "schema_version": 1,
  "id": "zia.malware-protection",
  "title": "ZIA Malware Protection",
  "aliases": [
    "malware protection",
    "malware protection policy",
    "zia antivirus",
    "mp policy",
    "zia malware scanning"
  ],
  "binds": [
    "zia/atp-malware-settings"
  ],
  "related": [
    {
      "rel": "see-also",
      "to": "zia.malware-protection.inspection"
    },
    {
      "rel": "see-also",
      "to": "zia.malware-protection.settings"
    },
    {
      "rel": "see-also",
      "to": "zia.malware-protection.api-surface"
    },
    {
      "rel": "depends-on",
      "to": "zia.ssl-inspection.bypass-impact"
    },
    {
      "rel": "interacts-with",
      "to": "zia.atp"
    },
    {
      "rel": "interacts-with",
      "to": "zia.atp.enforcement-order"
    },
    {
      "rel": "interacts-with",
      "to": "zia.atp.security-exceptions"
    },
    {
      "rel": "see-also",
      "to": "zia.atp.block-diagnosis"
    },
    {
      "rel": "see-also",
      "to": "zia.sandbox.verdicts"
    }
  ],
  "claims": {
    "global-policy": {
      "statement": "The Malware Protection policy applies globally to all an organization's locations.",
      "tier": "A",
      "evidence": [
        {
          "source": "zscaler-help",
          "path": "configuring-malware-protection-policy.md",
          "quotes": [
            "The Malware Protection policy applies globally to all an organization's locations."
          ]
        }
      ]
    },
    "no-rule-scoping": {
      "statement": "Malware Protection has no rules and no user, group or location scope: the page offers only the inspection toggles and one Allow or Block per malware category, and the API exposes four singleton objects.",
      "tier": "B",
      "evidence": [
        {
          "source": "zscaler-help",
          "path": "configuring-malware-protection-policy.md",
          "quotes": [
            "The Malware Protection policy applies globally to all an organization's locations."
          ]
        }
      ],
      "conditions": "Rests on the absence of a scoping control in the captured help page and on the API being four singleton endpoints (see zia.malware-protection.api-surface). Absence in two sources is not proof that no scoping exists."
    },
    "engine": {
      "statement": "Detection uses an industry-leading AV vendor for signature-based detection, plus malware feeds from trusted partners such as Microsoft and Adobe and Zscaler's own technologies.",
      "tier": "A",
      "evidence": [
        {
          "source": "zscaler-help",
          "path": "configuring-malware-protection-policy.md",
          "quotes": [
            "The Zscaler service uses an industry-leading AV vendor for signature-based detection and protection",
            "the service uses malware feeds from its trusted partners, such as Microsoft and Adobe, as well as its own technologies to detect and block malware."
          ]
        }
      ]
    },
    "dont-change-defaults": {
      "statement": "Zscaler recommends not changing the default settings of the Malware Protection policy.",
      "tier": "A",
      "evidence": [
        {
          "source": "zscaler-help",
          "path": "configuring-malware-protection-policy.md",
          "quotes": [
            "Zscaler recommends that you don't change the default settings of the Malware Protection policy to ensure the security of your user traffic."
          ]
        }
      ]
    },
    "recommended-policy": {
      "statement": "The recommended policy enables all five inspection toggles (Inbound, Outbound, HTTP, FTP over HTTP, FTP) and blocks all eight malware categories: Unwanted Applications, Trojans, Worms, Ransomware, Remote Access Tool, Other Viruses, Adware and Spyware.",
      "tier": "A",
      "evidence": [
        {
          "source": "zscaler-help",
          "path": "recommended-malware-protection-policy.md",
          "quotes": [
            "Enable Inspect Inbound Traffic.",
            "Enable Inspect Outbound Traffic.",
            "Enable Inspect HTTP.",
            "Enable Inspect FTP over HTTP.",
            "Enable Inspect FTP.",
            "Block Unwanted Applications.",
            "Block Trojans.",
            "Block Worms.",
            "Block Ransomware.",
            "Block Remote Access Tool.",
            "Block Other Viruses.",
            "Block Adware.",
            "Block Spyware."
          ]
        }
      ]
    },
    "exceptions-tab": {
      "statement": "The policy has a Security Exceptions tab, separate from the Malware Policy tab that holds the inspection toggles and categories. It holds the Password-Protected Files and Unscannable Files settings and the URL allowlist.",
      "tier": "A",
      "evidence": [
        {
          "source": "zscaler-help",
          "path": "configuring-malware-protection-policy.md",
          "quotes": [
            "To configure exceptions to the Malware Protection policy, click the Security Exceptions tab."
          ]
        },
        {
          "source": "zscaler-help",
          "path": "configuring-security-exceptions-malware-protection-policy.md",
          "quotes": [
            "You can configure security exceptions for the Malware Protection policy, including placing URLs on an allowlist and controlling unscannable or password-protected files."
          ]
        }
      ]
    },
    "allowlist-is-shared": {
      "statement": "The Malware Protection allowlist also applies to the Advanced Threat Protection and Sandbox policies. To allow URLs and files completely, URL Filtering and File Type Control must also be configured.",
      "tier": "A",
      "evidence": [
        {
          "source": "zscaler-help",
          "path": "configuring-security-exceptions-malware-protection-policy.md",
          "quotes": [
            "This allowlist also applies to the Advanced Threat Protection and Sandbox policies. If you want to allow URLs and files completely, you must also configure the URL Filtering and File Type Control policies."
          ]
        }
      ]
    },
    "save-and-activate": {
      "statement": "A change to the policy is saved and then activated in the console.",
      "tier": "A",
      "evidence": [
        {
          "source": "zscaler-help",
          "path": "configuring-malware-protection-policy.md",
          "quotes": [
            "Click Save and activate the change."
          ]
        }
      ]
    }
  }
}
