{
  "schema_version": 1,
  "id": "zia.saas-apps",
  "title": "SaaS apps that break or misbehave behind ZIA",
  "aliases": [
    "saas app quirks",
    "app breaks with ssl inspection",
    "browser quirks zscaler",
    "app works without zscaler",
    "saas root cause catalog",
    "certificate pinning duo webex dropbox",
    "why is this app failing through zscaler"
  ],
  "related": [
    { "rel": "see-also", "to": "zia.saas-apps.tenant-restriction-order" },
    { "rel": "see-also", "to": "zia.saas-apps.idp-bypass" },
    { "rel": "see-also", "to": "zia.saas-apps.conditional-access" },
    { "rel": "see-also", "to": "zia.saas-apps.quic-conferencing" },
    { "rel": "see-also", "to": "zia.saas-apps.shared-cdn-bypass" },
    { "rel": "interacts-with", "to": "zia.ssl-inspection.uninspectable" },
    { "rel": "interacts-with", "to": "zia.ssl-inspection.exemptions" },
    { "rel": "interacts-with", "to": "zia.tenant-profiles" }
  ]
}
